{
  "id": "class_wizard",
  "name": "Wizard",
  "hitDie": 6,
  "multiclassTraits": [],
  "startingEquipment": {
    "given": [
      {
        "kind": "item",
        "refId": "item_magic_item_spellbook",
        "quantity": 1
      }
    ],
    "choices": [
      {
        "choose": 1,
        "options": [
          {
            "equipmentBundle": [
              {
                "kind": "item",
                "refId": "item_weapon_quarterstaff",
                "quantity": 1
              }
            ]
          },
          {
            "equipmentBundle": [
              {
                "kind": "item",
                "refId": "item_weapon_dagger",
                "quantity": 1
              }
            ]
          }
        ]
      },
      {
        "choose": 1,
        "options": [
          {
            "equipmentBundle": [
              {
                "kind": "item",
                "refId": "item_gear_component_pouch",
                "quantity": 1
              }
            ]
          },
          {
            "equipmentBundle": [
              {
                "kind": "category",
                "refId": "category_arcane_focus",
                "quantity": 1
              }
            ]
          }
        ]
      },
      {
        "choose": 1,
        "options": [
          {
            "equipmentBundle": [
              {
                "kind": "item",
                "refId": "item_pack_scholars",
                "quantity": 1
              }
            ]
          },
          {
            "equipmentBundle": [
              {
                "kind": "item",
                "refId": "item_pack_explorers",
                "quantity": 1
              }
            ]
          }
        ]
      }
    ]
  },
  "subclassInfo": {
    "choiceLevel": 2,
    "optionsPool": "subclasses_wizard"
  },
  "progression": [
    {
      "level": 1,
      "features": [
        "trait_wizard_prof_saving_throw",
        "trait_wizard_prof_weapons",
        "trait_wizard_prof_skills",
        "trait_spellcasting_wizard",
        "trait_arcane_recovery"
      ]
    },
    {
      "level": 2,
      "features": [
        "trait_arcane_tradition"
      ]
    },
    {
      "level": 3,
      "features": []
    },
    {
      "level": 4,
      "features": [
        "trait_ability_score_improvement"
      ]
    },
    {
      "level": 5,
      "features": []
    },
    {
      "level": 6,
      "features": [
        "trait_arcane_tradition_feature"
      ]
    },
    {
      "level": 7,
      "features": []
    },
    {
      "level": 8,
      "features": [
        "trait_ability_score_improvement"
      ]
    },
    {
      "level": 9,
      "features": []
    },
    {
      "level": 10,
      "features": [
        "trait_arcane_tradition_feature"
      ]
    },
    {
      "level": 11,
      "features": []
    },
    {
      "level": 12,
      "features": [
        "trait_ability_score_improvement"
      ]
    },
    {
      "level": 13,
      "features": []
    },
    {
      "level": 14,
      "features": [
        "trait_arcane_tradition_feature"
      ]
    },
    {
      "level": 15,
      "features": []
    },
    {
      "level": 16,
      "features": [
        "trait_ability_score_improvement"
      ]
    },
    {
      "level": 17,
      "features": []
    },
    {
      "level": 18,
      "features": [
        "trait_spell_mastery"
      ]
    },
    {
      "level": 19,
      "features": [
        "trait_ability_score_improvement"
      ]
    },
    {
      "level": 20,
      "features": [
        "trait_signature_spell"
      ]
    }
  ],
  "lore": {
    "shortDescription": "Scholarly mages who research and master arcane magic through rigorous study and discipline.",
    "fullText": "Clad in the silver robes that denote her station, an elf closes her eyes to shut out the distractions of the battlefield and begins her quiet chant. Fingers weaving in front of her, she completes her spell and launches a tiny bead of tire toward the enemy ranks, where it erupts into a conflagration that engulfs the soldiers.\nChecking and rechecking his work, a human scribes an intricate magic circle in chalk on the bare stone floor, then sprinkles powdered iron along every line and graceful curve. When the circle is complete, he drones a long incantation. A hole opens in space inside the circle, bringing a whiff of brimstone from the otherworldly plane beyond.\nCrouching on the floor in a dungeon intersection, a gnome tosses a handful of small bones inscribed with mystic symbols, muttering a few words of power over them. Closing his eyes to see the visions more clearly, he nods slowly, then opens his eyes and points down the passage to his left.\nWizards are supreme magic-users, defined and united as a class by the spells they cast. Drawing on the subtle weave of magic that permeates the cosmos, wizards cast spells of explosive tire, arcing lightning, subtle deception, and brute=force mind control. Their magic conjures monsters from other planes of existence, glimpses the future, or turns slain foes into zombies. Their mightiest spells change one substance into another, call meteors down from the sky, or open portals to other worlds."
  }
}
