{
  "id": "class_rogue",
  "name": "Rogue",
  "hitDie": 8,
  "multiclassTraits": [
    "trait_rogue_mult_prof_armor",
    "trait_rogue_mult_prof_skills",
    "trait_rogue_mult_prof_tools"
  ],
  "startingEquipment": {
    "given": [
      {
        "kind": "item",
        "refId": "item_armor_leather",
        "quantity": 1
      },
      {
        "kind": "item",
        "refId": "item_weapon_dagger",
        "quantity": 2
      },
      {
        "kind": "item",
        "refId": "item_tool_thieves_tools",
        "quantity": 1
      }
    ],
    "choices": [
      {
        "choose": 1,
        "options": [
          {
            "equipmentBundle": [
              {
                "kind": "item",
                "refId": "item_weapon_rapier",
                "quantity": 1
              }
            ]
          },
          {
            "equipmentBundle": [
              {
                "kind": "item",
                "refId": "item_weapon_shortsword",
                "quantity": 1
              }
            ]
          }
        ]
      },
      {
        "choose": 1,
        "options": [
          {
            "equipmentBundle": [
              {
                "kind": "item",
                "refId": "item_weapon_shortbow",
                "quantity": 1
              },
              {
                "kind": "item",
                "refId": "item_weapon_arrow",
                "quantity": 20
              },
              {
                "kind": "item",
                "refId": "item_pack_quiver",
                "quantity": 1
              }
            ]
          },
          {
            "equipmentBundle": [
              {
                "kind": "item",
                "refId": "item_weapon_shortsword",
                "quantity": 1
              }
            ]
          }
        ]
      },
      {
        "choose": 1,
        "options": [
          {
            "equipmentBundle": [
              {
                "kind": "item",
                "refId": "item_pack_burglars",
                "quantity": 1
              }
            ]
          },
          {
            "equipmentBundle": [
              {
                "kind": "item",
                "refId": "item_pack_dungeoneers",
                "quantity": 1
              }
            ]
          },
          {
            "equipmentBundle": [
              {
                "kind": "item",
                "refId": "item_pack_explorers",
                "quantity": 1
              }
            ]
          }
        ]
      }
    ]
  },
  "subclassInfo": {
    "choiceLevel": 3,
    "optionsPool": "subclasses_rogue"
  },
  "progression": [
    {
      "level": 1,
      "features": [
        "trait_rogue_prof_saving_throw",
        "trait_rogue_prof_armor",
        "trait_rogue_prof_weapons",
        "trait_rogue_prof_tools",
        "trait_rogue_prof_skills",
        "trait_expertise",
        "trait_sneak_attack",
        "trait_thieves_cant"
      ],
      "classSpecificScaling": {
        "sneak_attack_dice": "1d6"
      }
    },
    {
      "level": 2,
      "features": [
        "trait_cunning_action"
      ],
      "classSpecificScaling": {
        "sneak_attack_dice": "1d6"
      }
    },
    {
      "level": 3,
      "features": [
        "trait_roguish_archetype"
      ],
      "classSpecificScaling": {
        "sneak_attack_dice": "2d6"
      }
    },
    {
      "level": 4,
      "features": [
        "trait_ability_score_improvement"
      ],
      "classSpecificScaling": {
        "sneak_attack_dice": "2d6"
      }
    },
    {
      "level": 5,
      "features": [
        "trait_uncanny_dodge"
      ],
      "classSpecificScaling": {
        "sneak_attack_dice": "3d6"
      }
    },
    {
      "level": 6,
      "features": [
        "trait_expertise"
      ],
      "classSpecificScaling": {
        "sneak_attack_dice": "3d6"
      }
    },
    {
      "level": 7,
      "features": [
        "trait_evasion_rogue"
      ],
      "classSpecificScaling": {
        "sneak_attack_dice": "4d6"
      }
    },
    {
      "level": 8,
      "features": [
        "trait_ability_score_improvement"
      ],
      "classSpecificScaling": {
        "sneak_attack_dice": "4d6"
      }
    },
    {
      "level": 9,
      "features": [
        "trait_roguish_archetype_feature"
      ],
      "classSpecificScaling": {
        "sneak_attack_dice": "5d6"
      }
    },
    {
      "level": 10,
      "features": [
        "trait_ability_score_improvement"
      ],
      "classSpecificScaling": {
        "sneak_attack_dice": "5d6"
      }
    },
    {
      "level": 11,
      "features": [
        "trait_reliable_talent"
      ],
      "classSpecificScaling": {
        "sneak_attack_dice": "6d6"
      }
    },
    {
      "level": 12,
      "features": [
        "trait_ability_score_improvement"
      ],
      "classSpecificScaling": {
        "sneak_attack_dice": "6d6"
      }
    },
    {
      "level": 13,
      "features": [
        "trait_roguish_archetype_feature"
      ],
      "classSpecificScaling": {
        "sneak_attack_dice": "7d6"
      }
    },
    {
      "level": 14,
      "features": [
        "trait_blindsense"
      ],
      "classSpecificScaling": {
        "sneak_attack_dice": "7d6"
      }
    },
    {
      "level": 15,
      "features": [
        "trait_slippery_mind"
      ],
      "classSpecificScaling": {
        "sneak_attack_dice": "8d6"
      }
    },
    {
      "level": 16,
      "features": [
        "trait_ability_score_improvement"
      ],
      "classSpecificScaling": {
        "sneak_attack_dice": "8d6"
      }
    },
    {
      "level": 17,
      "features": [
        "trait_roguish_archetype_feature"
      ],
      "classSpecificScaling": {
        "sneak_attack_dice": "9d6"
      }
    },
    {
      "level": 18,
      "features": [
        "trait_elusive"
      ],
      "classSpecificScaling": {
        "sneak_attack_dice": "9d6"
      }
    },
    {
      "level": 19,
      "features": [
        "trait_ability_score_improvement"
      ],
      "classSpecificScaling": {
        "sneak_attack_dice": "10d6"
      }
    },
    {
      "level": 20,
      "features": [
        "trait_stroke_of_luck"
      ],
      "classSpecificScaling": {
        "sneak_attack_dice": "10d6"
      }
    }
  ],
  "lore": {
    "shortDescription": "Cunning masters of stealth and skill who exploit vulnerabilities and find elegant solutions to any problem.",
    "fullText": "Signaling for her companions to wait, a halfling creeps forward through the dungeon hall. She presses an ear to the door, then pulls out a set of tools and picks the lock in the blink of an eye. Then she disappears into the shadows as her fighter friend moves forward to kick the door open.\nA human lurks in the shadows of an alley while his accomplice prepares for her part in the ambush. When their target-a notorious slaver-passes the alleyway, the accomplice cries out, the slaver comes to investigate, and the assassin's blade cuts his throat before he can make a sound.\nSuppressing a giggle, a gnome waggles her fingers and magically lifts the key ring from the guard's belt. In a moment, the keys are in her hand, the cell door is open, and she and her companions are free to make their escape.\nRogues rely on skill, stealth, and their foes' vulnerabilities to get the upper hand in any situation. They have a knack for finding the solution to just about any problem, demonstrating a resourcefulness and versatility that is the cornerstone of any successful adventuring party."
  }
}
