{
  "id": "class_fighter",
  "name": "Fighter",
  "hitDie": 10,
  "multiclassTraits": [
    "trait_fighter_mult_prof_armor",
    "trait_fighter_mult_prof_weapons"
  ],
  "startingEquipment": {
    "given": [],
    "choices": [
      {
        "choose": 1,
        "options": [
          {
            "equipmentBundle": [
              {
                "kind": "item",
                "refId": "item_armor_chain_mail",
                "quantity": 1
              }
            ]
          },
          {
            "equipmentBundle": [
              {
                "kind": "item",
                "refId": "item_armor_leather",
                "quantity": 1
              },
              {
                "kind": "item",
                "refId": "item_weapon_longbow",
                "quantity": 1
              },
              {
                "kind": "item",
                "refId": "item_weapon_arrow",
                "quantity": 20
              }
            ]
          }
        ]
      },
      {
        "choose": 1,
        "options": [
          {
            "equipmentBundle": [
              {
                "kind": "category",
                "refId": "category_weapon_martial",
                "quantity": 1
              },
              {
                "kind": "category",
                "refId": "category_armor_shield",
                "quantity": 1
              }
            ]
          },
          {
            "equipmentBundle": [
              {
                "kind": "category",
                "refId": "category_weapon_martial",
                "quantity": 2
              }
            ]
          }
        ]
      },
      {
        "choose": 1,
        "options": [
          {
            "equipmentBundle": [
              {
                "kind": "item",
                "refId": "item_weapon_light_crossbow",
                "quantity": 1
              },
              {
                "kind": "item",
                "refId": "item_weapon_crossbow_bolt",
                "quantity": 20
              }
            ]
          },
          {
            "equipmentBundle": [
              {
                "kind": "item",
                "refId": "item_weapon_handaxe",
                "quantity": 2
              }
            ]
          }
        ]
      },
      {
        "choose": 1,
        "options": [
          {
            "equipmentBundle": [
              {
                "kind": "item",
                "refId": "item_pack_dungeoneers",
                "quantity": 1
              }
            ]
          },
          {
            "equipmentBundle": [
              {
                "kind": "item",
                "refId": "item_pack_explorers",
                "quantity": 1
              }
            ]
          }
        ]
      }
    ]
  },
  "subclassInfo": {
    "choiceLevel": 3,
    "optionsPool": "subclasses_fighter",
    "optionLabel": "Martial Archetype"
  },
  "progression": [
    {
      "level": 1,
      "features": [
        "trait_fighter_prof_saving_throw",
        "trait_fighter_prof_armor",
        "trait_fighter_prof_weapons",
        "trait_fighter_prof_skills",
        "trait_fighting_style",
        "trait_second_wind"
      ]
    },
    {
      "level": 2,
      "features": [
        "trait_action_surge"
      ],
      "classSpecificScaling": {
        "action_surge_use_count": 1
      }
    },
    {
      "level": 3,
      "features": [
        "trait_martial_archetype"
      ]
    },
    {
      "level": 4,
      "features": [
        "trait_ability_score_improvement"
      ]
    },
    {
      "level": 5,
      "features": [
        "trait_extra_attack"
      ],
      "classSpecificScaling": {
        "extra_attack_count": 1
      }
    },
    {
      "level": 6,
      "features": [
        "trait_ability_score_improvement"
      ]
    },
    {
      "level": 7,
      "features": [
        "trait_martial_archetype_feature"
      ]
    },
    {
      "level": 8,
      "features": [
        "trait_ability_score_improvement"
      ]
    },
    {
      "level": 9,
      "features": [
        "trait_indomitable"
      ],
      "classSpecificScaling": {
        "indomitable_use_count": 1
      }
    },
    {
      "level": 10,
      "features": [
        "trait_martial_archetype_feature"
      ]
    },
    {
      "level": 11,
      "features": [
        "trait_extra_attack"
      ],
      "classSpecificScaling": {
        "extra_attack_count": 2
      }
    },
    {
      "level": 12,
      "features": [
        "trait_ability_score_improvement"
      ]
    },
    {
      "level": 13,
      "features": [
        "trait_indomitable"
      ],
      "classSpecificScaling": {
        "indomitable_use_count": 2
      }
    },
    {
      "level": 14,
      "features": [
        "trait_ability_score_improvement"
      ]
    },
    {
      "level": 15,
      "features": [
        "trait_martial_archetype_feature"
      ]
    },
    {
      "level": 16,
      "features": [
        "trait_ability_score_improvement"
      ]
    },
    {
      "level": 17,
      "features": [
        "trait_action_surge",
        "trait_indomitable"
      ],
      "classSpecificScaling": {
        "action_surge_use_count": 2,
        "indomitable_use_count": 3
      }
    },
    {
      "level": 18,
      "features": [
        "trait_martial_archetype_feature"
      ]
    },
    {
      "level": 19,
      "features": [
        "trait_ability_score_improvement"
      ]
    },
    {
      "level": 20,
      "features": [
        "trait_extra_attack"
      ],
      "classSpecificScaling": {
        "extra_attack_count": 3
      }
    }
  ],
  "lore": {
    "shortDescription": "Versatile masters of combat with unparalleled skill in weaponry, armor, and the tactical knowledge of warfare.",
    "fullText": "A human in clanging plate armor holds her shield before her as she runs toward the massed goblins. An elf behind her, clad in studded leather armor, peppers the goblins with arrows loosed from his exquisite bow. The half-orc nearby shouts orders, helping the two combatants coordinate their assault to the best advantage.\nA dwarf in chain mail interposes his shield between the ogre's club and his companion, knocking the deadly blow aside. His companion, a half-elf in scale armor, swings two scimitars in a blinding whirl as she circles the ogre, looking for a blind spot in its defenses.\nA gladiator fights for sport in an arena, a master with his trident and net, skilled at toppling foes and moving them around for the crowd's delight-and his own tactical advantage. His opponent's sword flares with blue light an instant before she sends lightning flashing forth to smite him.\nAll of these heroes are fighters, perhaps the most diverse class of characters in the worlds of Dungeons & Dragons. Questing knights, conquering overlords, royal champions, elite foot soldiers, hardened mercenaries, and bandit kings-as fighters, they all share an unparalleled mastery with weapons and armor, and a thorough knowledge of the skills of combat. And they are well acquainted with death, both meting it out and staring it defiantly in the face."
  }
}
