{
  "id": "class_cleric",
  "name": "Cleric",
  "hitDie": 8,
  "multiclassTraits": [
    "trait_cleric_mult_prof_armor",
    "trait_cleric_mult_prof_weapons"
  ],
  "startingEquipment": {
    "given": [
      {
        "kind": "category",
        "refId": "category_armor_shield",
        "quantity": 1
      },
      {
        "kind": "category",
        "refId": "category_holy_symbol",
        "quantity": 1
      }
    ],
    "choices": [
      {
        "choose": 1,
        "options": [
          {
            "equipmentBundle": [
              {
                "kind": "item",
                "refId": "item_weapon_mace",
                "quantity": 1
              }
            ]
          },
          {
            "equipmentBundle": [
              {
                "kind": "item",
                "refId": "item_weapon_warhammer",
                "quantity": 1
              }
            ]
          }
        ]
      },
      {
        "choose": 1,
        "options": [
          {
            "equipmentBundle": [
              {
                "kind": "item",
                "refId": "item_armor_scale_mail",
                "quantity": 1
              }
            ]
          },
          {
            "equipmentBundle": [
              {
                "kind": "item",
                "refId": "item_armor_leather",
                "quantity": 1
              }
            ]
          },
          {
            "equipmentBundle": [
              {
                "kind": "item",
                "refId": "item_armor_chain_mail",
                "quantity": 1,
                "condition": "proficiency_category_armor_heavy"
              }
            ]
          }
        ]
      },
      {
        "choose": 1,
        "options": [
          {
            "equipmentBundle": [
              {
                "kind": "item",
                "refId": "item_weapon_crossbow_light",
                "quantity": 1
              },
              {
                "kind": "item",
                "refId": "item_ammo_bolt",
                "quantity": 20
              }
            ]
          },
          {
            "equipmentBundle": [
              {
                "kind": "category",
                "refId": "category_weapon_simple",
                "quantity": 1
              }
            ]
          }
        ]
      },
      {
        "choose": 1,
        "options": [
          {
            "equipmentBundle": [
              {
                "kind": "item",
                "refId": "item_pack_priests",
                "quantity": 1
              }
            ]
          },
          {
            "equipmentBundle": [
              {
                "kind": "item",
                "refId": "item_pack_explorers",
                "quantity": 1
              }
            ]
          }
        ]
      }
    ]
  },
  "subclassInfo": {
    "choiceLevel": 1,
    "optionsPool": "subclasses_cleric",
    "optionLabel": "Divine Domain"
  },
  "progression": [
    {
      "level": 1,
      "features": [
        "trait_cleric_prof_saving_throw",
        "trait_cleric_prof_armor",
        "trait_cleric_prof_weapons",
        "trait_cleric_prof_skills",
        "trait_spellcasting_cleric",
        "trait_divine_domain"
      ]
    },
    {
      "level": 2,
      "features": [
        "trait_channel_divinity",
        "trait_divine_domain_feature"
      ],
      "classSpecificScaling": {
        "channel_divinity_uses_between_rests": 1
      }
    },
    {
      "level": 3,
      "features": []
    },
    {
      "level": 4,
      "features": [
        "trait_ability_score_improvement"
      ]
    },
    {
      "level": 5,
      "features": [
        "trait_destroy_undead"
      ],
      "classSpecificScaling": {
        "destroy_undead_max_cr": 0.5
      }
    },
    {
      "level": 6,
      "features": [
        "trait_channel_divinity",
        "trait_divine_domain_feature"
      ],
      "classSpecificScaling": {
        "channel_divinity_uses_between_rests": 2
      }
    },
    {
      "level": 7,
      "features": []
    },
    {
      "level": 8,
      "features": [
        "trait_ability_score_improvement",
        "trait_destroy_undead",
        "trait_divine_domain_feature"
      ],
      "classSpecificScaling": {
        "destroy_undead_max_cr": 1
      }
    },
    {
      "level": 9,
      "features": []
    },
    {
      "level": 10,
      "features": [
        "trait_divine_intervention"
      ]
    },
    {
      "level": 11,
      "features": [
        "trait_destroy_undead"
      ],
      "classSpecificScaling": {
        "destroy_undead_max_cr": 2
      }
    },
    {
      "level": 12,
      "features": [
        "trait_ability_score_improvement"
      ]
    },
    {
      "level": 13,
      "features": []
    },
    {
      "level": 14,
      "features": [
        "trait_destroy_undead"
      ],
      "classSpecificScaling": {
        "destroy_undead_max_cr": 3
      }
    },
    {
      "level": 15,
      "features": []
    },
    {
      "level": 16,
      "features": [
        "trait_ability_score_improvement"
      ]
    },
    {
      "level": 17,
      "features": [
        "trait_destroy_undead",
        "trait_divine_domain_feature"
      ],
      "classSpecificScaling": {
        "destroy_undead_max_cr": 4
      }
    },
    {
      "level": 18,
      "features": [
        "trait_channel_divinity"
      ],
      "classSpecificScaling": {
        "channel_divinity_uses_between_rests": 3
      }
    },
    {
      "level": 19,
      "features": [
        "trait_ability_score_improvement"
      ]
    },
    {
      "level": 20,
      "features": [
        "trait_divine_intervention_improvement"
      ]
    }
  ],
  "lore": {
    "shortDescription": "Divine intermediaries imbued with godly power, channeling miracles to heal the wounded and smite the wicked.",
    "fullText": "Arms and eyes upraised toward the sun and a prayer on his lips, an elf begins to glow with an inner light that spills out to heal his battle-worn companions.\nChanting a song of glory, a dwarf swings his axe in wide swaths to cut through the ranks of orcs arrayed against him, shouting praise to the gods with every foe's fall.\nCalling down a curse upon the forces of undeath, a human lifts her holy symbol as light pours from it to drive back the zombies crowding in on her companions.\nClerics are intermediaries between the mortal world and the distant planes of the gods. As varied as the gods they serve, clerics strive to embody the handiwork of their deities. No ordinary priest, a cleric is imbued with divine magic."
  }
}
